{
  "market": "JP",
  "version": "1.0.0",
  "last_verified": "2026-07-07",
  "verified_by": "ai",
  "derived_from": "concerns/jp.json v1.0.0",
  "personas": [
    {
      "id": "JP-2029-pore",
      "age_band": "20-29",
      "linked_concerns": ["毛穴 (모공)", "皮脂・テカリ (피지)"],
      "label": "毛穴・皮脂が気になる20代Kビューティー好き",
      "description": "SNSで韓国コスメ情報を収集。プチプラ(1,000〜3,000円)で毛穴・皮脂ケアを求める。ビタミンC美容液への関心が高くリピート志向。",
      "evidence": "エクスクリエ2025(20代最多=ニキビ/毛穴) + 楽天・Yahoo Kビューティー ビタミンC美容液ランキング(1,000〜3,000円帯)",
      "copy_direction": "毛穴の目立たないなめらかな肌印象を、予防・キメを整える範囲で訴求。治療的表現は使わない。",
      "channels": ["Instagram", "Qoo10", "楽天市場", "ドラッグストア"]
    },
    {
      "id": "JP-3039-dull",
      "age_band": "30-39",
      "linked_concerns": ["くすみ (칙칙함)", "乾燥・インナードライ (건조)"],
      "label": "くすみ・インナードライが気になる30代",
      "description": "混合肌でうるおいと透明感を両立したい。成分重視で口コミを比較検討。ビタミンCの明るい印象づくりに期待。",
      "evidence": "エクスクリエ2025(30代最多=毛穴、インナードライ増加) + Kビューティー ビタミンC トレンド",
      "copy_direction": "うるおいで肌を整え透明感のある印象へ、という予防・整肌の範囲で訴求。美白・漂白表現は禁止。",
      "channels": ["Instagram", "@cosme", "楽天市場"]
    },
    {
      "id": "JP-4049-spot",
      "age_band": "40-49",
      "linked_concerns": ["シミ (기미)", "乾燥による小じわ (잔주름)"],
      "label": "シミ予防・エイジングケア志向の40代",
      "description": "シミ・ハリを気にしエイジングケアに投資。効能の根拠を重視し、薬機法に沿った信頼できる訴求を好む。",
      "evidence": "エクスクリエ2025(40代最多=シミ、エイジングケア関心) ",
      "copy_direction": "日焼けによるシミ・そばかすを防ぐ(予防)+乾燥による小じわを目立たなくする範囲で訴求。「消す」等の治療的表現は不可。",
      "channels": ["@cosme", "百貨店", "楽天市場", "ドラッグストア"]
    }
  ]
}
